index	bill_title	bill_summary	company_name	company_description	answer
0	To approve the settlement of water rights claims of the Hualapai Tribe and certain allottees in the State of Arizona, to authorize construction of a water project relating to those water rights claims, and for other purposes.	"Hualapai Tribe Water Rights Settlement Act of 2019

This bill modifies and ratifies the Hualapai Tribe water rights settlement agreement negotiated between the tribe, the United States, Arizona, and others, thus satisfying the tribe's claims for groundwater and surface water rights to water in Arizona, including the Verde River, the Bill Williams River, and the Colorado River.

The bill outlines the tribe's water rights, including the right to divert, use, and store 4,000 acre-feet of agricultural priority water of the Central Arizona Project that was previously allocated to nontribal agricultural entities, but retained by the Department of the Interior for reallocation to tribes in Arizona pursuant to the Central Arizona Project Settlement Act of 2004.

The Bureau of Reclamation must construct the Hualapai Water Project. The project must be designed to divert, treat, and convey at least 3,414 acre-feet of water per year from the Colorado River for municipal, commercial, and industrial uses on the Hualapai Reservation.

The bill provides for land to be added to the reservation and taken into trust for the benefit of the tribe. In the future, land located outside the reservation may only be taken into trust through an act of Congress.

The bill outlines (1) waivers, releases, and retentions of claims by the tribe and the United States under the settlement agreement; and (2) a limited waiver of sovereign immunity by the United States and the tribe with respect to certain claims."	BJ's Restaurants, Inc.	"the total domestic capacity for our restaurants;  expectations for consumer spending on casual dining restaurant occasions; •  the availability and cost of key commodities and labor used in our restaurants and brewing operations;  menu price increases and their effect, if any, on revenue and results of operations;  projected revenues, operating costs, including commodities, labor and other expenses;  Any inability to open new restaurants on schedule in accordance with our targeted capacity growth or problems associated with securing suitable restaurant locations, leases and licenses, recruiting and training qualified 1 managers and hourly employees and other factors, some of which are beyond our control and difficult to forecast accurately may adversely affect our operations.  Our corporate office is located in California and a significant number of our restaurants are located in California, Texas and Florida which makes us particularly sensitive to economic, regulatory, weather and other risk factors and conditions that are more prevalent in those states.  Any negative publicity about us, our restaurants, other restaurants, or others across the food supply chain, due to food borne illness or other reasons, whether or not accurate may adversely affect the reputation and popularity of our restaurants and our results of operations.  Any adverse changes in the supply of food, labor, brewing, energy and other expenses, including those resulting from climate change, may adversely affect our operating results.  Periodic reviews and audits of our internal brewing, independent third party brewing and beer distribution arrangements by various federal, state and local governmental and regulatory agencies may adversely affect our operations and our operating results.  Government laws and regulations affecting the operation of our restaurants, including but not limited to those that apply to the acquisition and maintenance of our brewing and retail liquor licenses, minimum wages, federal or state exemption rules, health insurance coverage, or other employment benefits such as paid time off, consumer health and safety, nutritional disclosures, and employment eligibility-related documentation requirements may cause disruptions to our operations, adversely affect our operating costs and restrict our growth.  The first BJ's restaurant, which opened in 1978 in Orange County, California, was a small sit down pizzeria that featured Chicago style deep-dish pizza with a unique California twist. Our goal then and still today, is to be the best casual dining concept ever by focusing on high quality menu options, at a compelling value, a dining experience that exceeds customers' expectations for service, hospitality and enjoyment, and an atmosphere that is always welcoming and approachable.  In 1996, we introduced our initial proprietary craft beers and expanded the BJ's concept from its beginnings as a small pizzeria to a full-service, high energy casual dining restaurant when we opened our first large format restaurant featuring a brewing operations in Brea, California. Today our restaurants feature over 140 menu offerings including: slow roasted entrees, such as, prime rib; EnLIGHTened Entrees® such as our Cherry Chipotle Glazed Salmon; our original signature deep-dish pizza; the often imitated, but never replicated world-famous Pizookie® dessert; and our award-winning BJ's proprietary craft beers. As of February 25, 2019, we own and operate 202 restaurants located in 27 states, and our proprietary craft beer is produced at several of our locations, our Temple, Texas brewpub locations and by independent third party brewers using our proprietary recipes.  We compete in the casual dining segment of the restaurant industry, which is a large, highly fragmented segment with estimated annual sales in the $100+ billion range. We believe that the BJ's restaurant concept offers consumers a higher quality, more contemporary and approachable ""casual plus,"" ""premium casual,"" or ""polished casual"" dining experience than the more mature, mass market casual dining concepts. Our Gold Standard of Operational Excellence is our genuine commitment to take pride in passionately connecting with every customer on every visit, through flawless and relentless execution of every detail, during every shift – to create and keep fanatical fans of BJ' Our Gold Standard of Operational Excellence is focused on the following key areas that help to differentiate BJ's from other casual dining restaurants:  Over the years we have expanded the BJ's concept to include menu options that meet our customers ' preferences for any dining occasion."	No
1	To amend the Internal Revenue Code of 1986 to create a Pension Rehabilitation Trust Fund, to establish a Pension Rehabilitation Administration within the Department of the Treasury to make loans to multiemployer defined benefit plans, and for other purposes.	"Rehabilitation for Multiemployer Pensions Act of 2019

This bill establishes the Pension Rehabilitation Administration within the Department of the Treasury and a related trust fund to make loans to certain multiemployer defined benefit pension plans.

To receive a loan, a plan must be (1) in critical and declining status, including any plan with respect to which a suspension of benefits has been approved; (2) in critical status, have a modified funded percentage of less than 40%, and have a ratio of active to inactive participants which is less than two to five; or (3) insolvent, if the plan became insolvent after December 16, 2014, and has not been terminated.

Treasury must transfer amounts, which may include proceeds from bonds and other obligations, from the general fund to the trust fund established by this bill as necessary to fund the program. The Pension Rehabilitation Administration may use the funds, without a further appropriation, to make loans, pay principal and interest on obligations, or for administrative and operating expenses.

The bill allows the sponsor of a multiemployer pension plan that is applying for a loan under this bill to also apply to the Pension Benefit Guaranty Corporation (PBGC) for financial assistance if, after receiving the loan, the plan will still become (or remain) insolvent within the 30-year period beginning on the date of the loan.

The bill also appropriates to the PBGC the funds that are necessary to provide the financial assistance required by this bill.

The bill modifies the requirements for the distribution of remaining pension benefits from certain defined contribution plans to a designated beneficiary upon death of an employee. The bill increases penalties for failure to file a tax return, and certain retirement plan returns."	Public Storage	"We acquire, develop, own and operate self-storage facilities , which offer storage spaces for lease on a month-to-month basis, for personal and business use. We are the largest owner and operator of self-storage facilities in the U.S. We have direct and indirect equity interests in 2,429 self-storage facilities that we consolidate (an aggregate of 162 million net rentable square feet of space) located in 38 states within the U.S. operating under the ""Public Storage"" brand name.  Ancillary Operations : We reinsure policies against losses to goods stored by customers in our self-storage facilities and sell merchandise, primarily locks and cardboard boxes, at our self-storage facilities.  Inc. (""PSB""), a publicly held REIT that owns, operates, acquires and develops commercial properties, primarily multi-tenant flex, office, and industrial parks. At December 31, 201 8 , PSB owns and operates 28. 2 million rentable square feet of commercial space.  : We have a 35 % equity inter est in Shurgard Self Storage SA (""Shurgard Europe""), a publicly held company trading under Euronext Brussels under the ""SHUR"" symbol , which owns 232 self-storage facilities (13 million net rentable square feet) located in seven countries in Western Europe operated under the ""Shurgard"" brand name. We believe Shurgard Europe is the largest owner and operator of self-storage facilities in Western Europe.  We also manage 33 self-storage facilities for third parties . We are seeking to expand our third-party management operations to further increase our economies of scale and leverage our brand; however, there is no 5 assurance that we will be able to do so. We also own 0.8 million net rentable square feet of commercial space which is managed primarily by PSB .  For all periods presented herein, we have elected to be treated as a REIT, as defined in the Internal Revenue Code of 1986, as amended (the ""Code"") . and we expect to continue to elect and qualify as a REIT.  We believe that our customers genera lly store their goods within a three to f ive mile radius of their home or business . Our facilities compete with nearby self-storage facilities owned by other operators using marketing channels similar to ours , including Internet advertising, signage, and banners and offer services similar to ours . A s a result, competition is significant and affects the occupancy levels, rental rates, rental income and operating expenses of our facilities.  In the last three years, there has been a marked increase in development of new self-storage facilities in many of the markets we operate in, due to the favorable economics of development which we have also taken advantage of. These newly developed facilities compete with many of the facilities we own, negatively impacting our occupancies, rental rates, and rental growth. This increase in supply has been most notable in Atlanta, Austin, Charlotte, Chicago, Dallas, Denver, Houston, New York, and Portland.  Ownership and operation of self-storage facilities is highly fragmented. As the largest owner of self-storage facilities, we believe that we own approximately 7 % of the self-storage square footage in the U.S. and that collectively the five largest self-storage owners in the U.S. own approximately 15 %, with the remaining 8 5 % owned by numerous regional and local operators.  We believe that we have significant market share and concentration in major metropolitan centers, with approximately 71 % of our 201 8 same-store revenues generated in the 20 Metropolitan Statistical Areas (each, an ""MSA"", as defined by the U.S. Census Bureau) with the highest population levels. Industry fragmentation also provides opportunities for us to acquire additional facilities; however, we compete with a wide variety of institutions and other investors who also view self-storage facilities as attractive investments. The amount of capital available for real estate investments greatly influences the competition for ownership interests in facilities and, by extension, the yields that we can achieve on newly acquired investments.  a s well as analyze customer data and quickly change each of our individual properties"	No
2	To reauthorize the Violence Against Women Act of 1994, and for other purposes.	"Violence Against Women Reauthorization Act of 2019

This bill modifies and reauthorizes through FY2024 programs and activities under the Violence Against Women Act that seek to prevent and respond to domestic violence, sexual assault, dating violence, and stalking.

Among other things, the bill also authorizes new programs, makes changes to federal firearms laws, and establishes new protections to promote housing stability and economic security for victims of domestic violence, sexual assault, dating violence, and stalking."	2U, Inc.	Our mission is to improve lives by eliminating the back row in higher education.  We are a global leader in education technology. For more than a decade, we have been improving lives by powering world-class digital education. As a trusted partner and brand steward of great universities, we build, deliver, and support online graduate programs and certificates for working adults. Our industry-leading short courses, offered by GetSmarter, are designed to equip life-long learners with in-demand career skills.  Over the past decade, we have developed new and innovative tools within our platform to enhance the effectiveness of instructional methods and improve student outcomes and the student experience. During that time, we have also improved our data-driven digital marketing capabilities across our ecosystem of offerings to generate increased student enrollments in a cost effective manner. As a result, demand for our comprehensive platform of integrated technology and services has increased significantly. When 2U was formed in 2008, we had one university client and one 2U-powered graduate program. Today, our university client base has grown to 35, our platform powers 49 graduate programs and over 90 short courses, and from inception to date we have enrolled over 44,000 students in 2U-powered graduate programs and over 86,000 students in our short courses.  Our core strategy is to launch graduate programs and short courses with new and existing university clients, to increase student enrollments and graduations across our portfolio of offerings and to expand our non-degree offerings across the career curriculum continuum. We are also committed to continuously improving our platform to deliver high-quality university and student experiences and outcomes at scale.  In our Short Course Segment, we target working professionals seeking career advancement through skills attainment.  Our Graduate Program Segment derives revenue primarily from a contractually specified percentage of the amounts our university clients receive from their students in the 2U-enabled graduate program for tuition and fees, less credit card fees and other specified charges we have agreed to exclude in certain of our universicty client contracts. The Short Course Segment derives revenue directly from students for the tuition and fees paid to enroll in and progress through our short courses. We share a contractually specified percentage of the tuition and fees received from students in each course with the relevant university client.  Our platform, which we refer to as the 2U Operating System, or 2UOS, consists of a seamlessly integrated ecosystem of technology, people and data. Through 2UOS, we provide our university clients with front-end and back-end cloud-based SaaS technology and technology-enabled services. These two components are tightly integrated and optimized with data analysis and machine learning techniques. 2UOS delivers technology with a human touch and is the keystone of our commitment to provide our university clients the tools they need to lead the digital transformation in education.  2UOS provides the following front-end technology and services to students enrolled in our offerings and to faculty members and university administrators supporting our offerings:  Our online learning platform is a cohesive end-to-end learning and teaching platform, where our university clients can reliably deliver their high-quality educational content to students. For our Graduate Program Segment, our online learning platform replicates an intimate and live classroom environment and is accessible through proprietary web, mobile and TV applications as well as in an offline mode for convenient consumption of asynchronous coursework. With the recent integration of stem-based education tools and collaborative annotation technology and an improved data-driven user experience, we have significantly enhanced the learning experience for students in 2U-powered graduate programs and instruction capabilities for faculty. Our short course offerings are delivered through a separate proprietary learning platform that shares many of the core features of our Graduate Program Segment learning platform, with some exceptions, such as the enhanced features that facilitate the live classroom environment in our graduate program leaning platform. 	No
3	A bill to extend the commitment of the United States to the International Space Station, to develop advanced space suits, and to enable human space settlement, and for other purposes.	"Advancing Human Spaceflight Act

This bill addresses the establishment of U.S. policy, programs, and activities pertaining to human presence in space.

The bill declares that it is U.S. policy to permanently establish a human presence in low-Earth orbit and that such capability shall

 maintain U.S. global leadership and relations with partners and allies, contribute to the general welfare of the United States, and be affordable so as to not preclude a robust portfolio of other human space exploration activities. The National Aeronautics and Space Administration (NASA) shall ensure that the International Space Station (ISS) remains a viable and productive facility capable of potential U.S. use through at least FY2030.

NASA must submit a strategy that includes how it will transition to a successor platform to the ISS.

The bill expands the objectives of NASA to include the expansion of permanent human presence beyond Earth in a way that enables human space settlement and a thriving space economy.

NASA shall establish a program of developing space suits and associated technologies."	2U, Inc.	Our mission is to improve lives by eliminating the back row in higher education.  We are a global leader in education technology. For more than a decade, we have been improving lives by powering world-class digital education. As a trusted partner and brand steward of great universities, we build, deliver, and support online graduate programs and certificates for working adults. Our industry-leading short courses, offered by GetSmarter, are designed to equip life-long learners with in-demand career skills.  Over the past decade, we have developed new and innovative tools within our platform to enhance the effectiveness of instructional methods and improve student outcomes and the student experience. During that time, we have also improved our data-driven digital marketing capabilities across our ecosystem of offerings to generate increased student enrollments in a cost effective manner. As a result, demand for our comprehensive platform of integrated technology and services has increased significantly. When 2U was formed in 2008, we had one university client and one 2U-powered graduate program. Today, our university client base has grown to 35, our platform powers 49 graduate programs and over 90 short courses, and from inception to date we have enrolled over 44,000 students in 2U-powered graduate programs and over 86,000 students in our short courses.  Our core strategy is to launch graduate programs and short courses with new and existing university clients, to increase student enrollments and graduations across our portfolio of offerings and to expand our non-degree offerings across the career curriculum continuum. We are also committed to continuously improving our platform to deliver high-quality university and student experiences and outcomes at scale.  In our Short Course Segment, we target working professionals seeking career advancement through skills attainment.  Our Graduate Program Segment derives revenue primarily from a contractually specified percentage of the amounts our university clients receive from their students in the 2U-enabled graduate program for tuition and fees, less credit card fees and other specified charges we have agreed to exclude in certain of our universicty client contracts. The Short Course Segment derives revenue directly from students for the tuition and fees paid to enroll in and progress through our short courses. We share a contractually specified percentage of the tuition and fees received from students in each course with the relevant university client.  Our platform, which we refer to as the 2U Operating System, or 2UOS, consists of a seamlessly integrated ecosystem of technology, people and data. Through 2UOS, we provide our university clients with front-end and back-end cloud-based SaaS technology and technology-enabled services. These two components are tightly integrated and optimized with data analysis and machine learning techniques. 2UOS delivers technology with a human touch and is the keystone of our commitment to provide our university clients the tools they need to lead the digital transformation in education.  2UOS provides the following front-end technology and services to students enrolled in our offerings and to faculty members and university administrators supporting our offerings:  Our online learning platform is a cohesive end-to-end learning and teaching platform, where our university clients can reliably deliver their high-quality educational content to students. For our Graduate Program Segment, our online learning platform replicates an intimate and live classroom environment and is accessible through proprietary web, mobile and TV applications as well as in an offline mode for convenient consumption of asynchronous coursework. With the recent integration of stem-based education tools and collaborative annotation technology and an improved data-driven user experience, we have significantly enhanced the learning experience for students in 2U-powered graduate programs and instruction capabilities for faculty. Our short course offerings are delivered through a separate proprietary learning platform that shares many of the core features of our Graduate Program Segment learning platform, with some exceptions, such as the enhanced features that facilitate the live classroom environment in our graduate program leaning platform. 	No
