index	bill_title	bill_summary	company_name	company_description	answer
4	A bill to amend title 44, United States Code, to modernize the Federal Register, and for other purposes.	"Federal Register Modernization Act

This bill revises provisions regarding the Federal Register or the Code of Federal Regulations, including to replace requirements that the documents be printed with requirements that the documents be published.

The bill provides that in a continuity of operations event in which the Government Publishing Office (GPO) does not fulfill its publication requirements, the Office of the Federal Register may establish a website to publish the Federal Register until such time that GPO resumes publication."	Primerica, Inc.	"""us"" or the ""Parent Company"") is a leading provider of financial products to middle-income households in the United States and Canada with 130,736 licensed sales representatives as of December 31, 2018. This network of independent contractor sales representatives (""sales representatives"" or ""sales force"") assists our clients in meeting their needs for term life insurance, which we underwrite, and mutual funds, annuities, managed investments and other financial products, which we distribute primarily on behalf of third parties. Licensed sales representatives primarily use our proprietary financial needs analysis tool (""FNA"") and an educational approach to demonstrate how our product offerings can assist clients to provide financial protection for their families, save for their retirement and other needs, and manage their debt. Typically, our clients are the friends, family members and personal acquaintances of sales representatives. We provide an entrepreneurial business opportunity for individuals to distribute financial products. Low entry fees as well as the ability to select their own schedules and time commitments allow sales representatives to supplement their income by starting their own independent businesses without leaving their current jobs. Our unique compensation structure, technology, sales support and back-office processing are designed to enable sales representatives to successfully grow their independent businesses.  We believe there is significant opportunity to meet the increasing array of financial services needs of our clients. We intend to leverage the sales force to meet such client needs, which will drive long-term value for all of our stakeholders. • Broadening and strengthening our protection product portfolio; •  Providing offerings that enhance our Investment and Savings Products (""ISP"") business; and •  Developing digital capabilities to deepen our client relationships.  Primerica Life Insurance Company (""Primerica Life""), our principal life insurance underwriting company; and •  (""PFS Investments""), our investment and savings products company, broker-dealer and registered investment advisor.  Primerica Life is domiciled in Tennessee, and its wholly owned subsidiary, National Benefit Life Insurance Company (""NBLIC""), is a New York-domiciled life insurance underwriting company.  Primerica Life Insurance Company of Canada (""Primerica Life Canada""), our Canadian life insurance underwriting company; •  (""PFSL Investments Canada""), our Canadian licensed mutual fund dealer; and •  (""PFSL Fund Management""), our Canadian investment funds manager.  Our clients are generally middle-income consumers, which we define as households with $30,000 to $100,000 of annual income. According to the 2017 U.S. Census Bureau Current Population Survey, the latest period for which data is available, almost 50% of U.S. households fall in this range. Many have inadequate or no life insurance coverage. Individual life insurance sales in the United States declined from 12.5 million policy sales in 1975 to 9.8 million policy sales in 2017, the latest period for which data is available, according to the Life Insurance Marketing and Research Association International, Inc. (""LIMRA""), a worldwide association of insurance and financial services companies. We believe that term life insurance, which we have provided to middle-income clients for many years, is generally the best option for them to meet their life insurance needs.  Many need help saving for retirement and other personal goals."	No
5	To intensify stem cell research showing evidence of substantial clinical benefit to patients, and for other purposes.	"Patients First Act of 2019

This bill requires the National Institutes of Health (NIH) to support stem cell research. Specifically, the NIH must conduct and support basic and applied research to develop techniques for the isolation, derivation, production, testing, and human clinical use of stem cells that may result in improved understanding of, or treatments for, diseases and other adverse health conditions. However, such techniques must not involve (1) the creation of a human embryo for research purposes; (2) the destruction or discarding of, or risk of injury to, a human embryo; or (3) the use of any stem cell the derivation or provision of which would be inconsistent with this bill.

The NIH must also report on peer-reviewed stem cell research proposals that were not funded."	Acceleron Pharma, Inc.	"We are a leading biopharmaceutical company in the discovery and development of TGF-beta therapeutics to treat serious and rare diseases. Our research focuses on key natural regulators of cellular growth and repair, particularly the Transforming Growth Factor-Beta, or TGF-beta, protein superfamily. By combining our discovery and development expertise, including our proprietary knowledge of the TGF-beta superfamily, and our internal protein engineering and manufacturing capabilities, we have generated several innovative therapeutic candidates, all of which encompass novel potential first-in-class mechanisms of action. We have focused and prioritized our research and development activities within three key therapeutic areas: hematologic, neuromuscular and pulmonary. If successful, these candidates could have the potential to significantly improve clinical outcomes for patients across these areas of high, unmet need.  Luspatercept, our lead program, and sotatercept, are partnered with Celgene Corporation, or Celgene. Luspatercept is an erythroid maturation agent designed to promote red blood cell production through a novel mechanism, and is being developed to treat chronic anemia and associated complications in myelodysplastic syndromes, or MDS, beta-thalassemia, and myelofibrosis. Celgene is currently conducting two Phase 3 clinical trials with luspatercept; one for the treatment of patients with lower-risk MDS, known as the ""MEDALIST"" trial, and another for the treatment of patients with beta-thalassemia, also known as the ""BELIEVE"" trial. Celgene has recently initiated a Phase 2 trial in non-transfusion-dependent beta-thalassemia patients, referred to as the ""BEYOND"" trial. We further expect Celgene to initiate a Phase 3 clinical trial, the ""COMMANDS"" trial, in first-line, lower-risk MDS patients in the first half of 2018. Enrollment is also currently ongoing in a Phase 2 clinical trial for the treatment of patients with myelofibrosis, a rare bone marrow disorder. If luspatercept were to receive regulatory approval for each of these indications in the United States and Europe, we believe that there is an aggregate sales opportunity for this product in excess of $2 billion.  For sotatercept, we announced in September 2017 that Celgene granted us the rights to fund, develop, and lead the global commercialization of sotatercept in pulmonary hypertension, including pulmonary arterial hypertension, or PAH. PAH is a rare and chronic, rapidly progressing disorder characterized by the constriction of small pulmonary arteries, resulting in abnormally high blood pressure in the pulmonary arteries. If sotatercept is commercialized to treat PAH and we recognize such revenue, then Celgene will be eligible to receive a royalty in the low 20% range on global net sales. We expect to initiate a Phase 2 clinical trial for the treatment of patients with PAH in the first half of 2018.  For luspatercept and, outside of pulmonary hypertension, sotatercept, Celgene is responsible for paying 100% of the development costs for all clinical trials. ACE-083 is designed for the treatment of focal muscle disorders, and we are currently conducting Phase 2 clinical trials with ACE-083 in patients with facioscapulohumeral dystrophy, or FSHD, as well as in patients with Charcot-Marie-Tooth disease, or CMT. In January 2018, we announced preliminary results for the first two cohorts in part 1 of the Phase 2 clinical trial with ACE-083 in patients with FSHD showing marked increases in the mean total muscle volume of the muscles treated with ACE-083 measured using magnetic resonance imaging, or MRI. We expect to initiate part 2 of the ACE-083 FSHD Phase 2 trial during the second quarter of this year, and we expect to report preliminary results from all dose-escalation cohorts of part 1 in our FSHD and CMT Phase 2 clinical trials with ACE-083 in the second half of this year.  In addition to our mid- to late-stage clinical programs, we initiated a Phase 1 healthy volunteer study in early 2018 with ACE-2494, our wholly-owned systemic muscle agent from our proprietary platform technology, IntelliTrap™, and we expect to report initial results from this healthy volunteer study in the first half of 2019. We are also conducting research within our three focused disease areas—hematologic, neuromuscular and pulmonary—in order to identify new therapeutic candidates to advance into clinical trials.  As of December 31, 2017 our operations have been funded primarily by $105.1 million in equity investments from venture investors, $539.7 million from public investors, $123.7 million in equity investments from our collaboration partners and $273.7 million in upfront payments, milestones, and net research and development payments from our collaboration partners. Announce MEDALIST Phase 3 clinical trial top-line results in mid-2018.  Initiate the COMMANDS Phase 3 clinical trial in the first half of 2018. "	Yes
6	To amend title XVIII of the Social Security Act to require the Secretary of Health and Human Services to negotiate prices of prescription drugs furnished under part D of the Medicare program.	"Medicare Negotiation and Competitive Licensing Act of 2019

This bill requires the Centers for Medicare & Medicaid Services (CMS) to negotiate with pharmaceutical companies regarding prices for drugs covered under the Medicare prescription drug benefit. (Current law prohibits the CMS from doing so.)

The CMS must take certain factors into account during negotiations, including the clinical- and cost-effectiveness of the drug, the financial burden on patients, and unmet patient needs. If the CMS is unable to negotiate the price of a drug, such drug is subject to competitive licensing in order to further its sale under Medicare, notwithstanding existing government-granted exclusivities.

Additionally, for one year after a drug is provided under a competitive license, such drug is also subject to specified price limitations; if the drug is not offered at such prices, the drug is subject to additional licensing that furthers its sale under any federal program (e.g., Medicaid)."	Alkermes Plc	"Alkermes plc is a fully integrated, global biopharmaceutical company that applies its scientific expertise and proprietary technologies to research, develop and commercialize, both with partners and on its own, pharmaceutical products that are designed to address unmet medical needs of patients in major therapeutic areas. Alkermes has a diversified portfolio of marketed drug products and a clinical pipeline of products that address central nervous system (""CNS"") disorders such as schizophrenia, depression, addiction and multiple sclerosis (""MS""). Headquartered in Dublin, Ireland, Alkermes has a research and development (""R & D"") center in Waltham, Massachusetts; an R & D and manufacturing facility in Athlone, Ireland; and a manufacturing facility in Wilmington, Ohio.  The key marketed products discussed below are expected to generate significant revenues for us. None Commercialized by Alkermes in the U.S. Alcohol dependence and Opioid dependence  Russia and Commonwealth of Independent States (""CIS"") 5 Summary information regarding products that use our proprietary technologies: Product Indication(s)  Treatment to improve walking in patients with MS, as demonstrated by an increase in walking speed  We develop and commercialize products designed to address the unmet needs of patients suffering from addiction and schizophrenia.  ARISTADA ARISTADA (aripiprazole lauroxil) is an extended-release intramuscular injectable suspension approved in the U.S. for the treatment of schizophrenia. ARISTADA is the first of our products to utilize our proprietary LinkeRx technology. ARISTADA is a prodrug; once in the body, ARISTADA is likely converted by enzyme-mediated hydrolysis to N-hydroxymethyl aripiprazole, which is then hydrolyzed to aripiprazole. ARISTADA is the first atypical antipsychotic with once-monthly, once-every-six-weeks and once-every-two-months dosing options to deliver and maintain therapeutic levels of medication in the body. ARISTADA has four dosing options (441 mg, 662 mg, 882 mg and 1064 mg) and is packaged in a ready-to-use, pre-filled product format. ARISTADA 1064 mg, our two-month dosing option, was approved by the U.S. Food and Drug Administration (the ""FDA"") in June 2017. We developed ARISTADA and manufacture and commercialize it in the U.S.  Schizophrenia is a chronic, severe and disabling brain disorder. The disease is marked by positive symptoms (hallucinations and delusions) and negative symptoms (depression, blunted emotions and social withdrawal), as well as by disorganized thinking. An estimated 2.4 million Americans over the age of 18 have schizophrenia in a given year, with men and women affected equally. Worldwide, it is estimated that one person in every 100 develops schizophrenia. Studies have demonstrated that as many as 75% of patients with schizophrenia have difficulty taking their oral medication on a regular basis, which can lead to worsening of symptoms.  VIVITROL VIVITROL (naltrexone for extended-release injectable suspension) is a once-monthly, non-narcotic, injectable medication approved in the U.S., Russia and certain countries of the CIS for the treatment of alcohol dependence and for the prevention of relapse to opioid dependence, following opioid detoxification. VIVITROL uses our polymer-based microsphere injectable extended-release technology to deliver and maintain therapeutic medication levels in the body through one intramuscular injection every four weeks. We developed and exclusively manufacture VIVITROL. What are opioid dependence and alcohol dependence?  Opioid dependence is a serious and chronic brain disease characterized by compulsive, prolonged self-administration of opioid substances that are not used for a medical purpose."	Yes
7	To prohibit discrimination against individuals with disabilities who need long-term services and supports, and for other purposes.	"Disability Integration Act of 2019

This bill prohibits government entities and insurance providers from denying community-based services to individuals with disabilities that require long-term service or support that would enable such individuals to live in the community and lead an independent life.

Specifically, these entities may not discriminate against such individuals in the provision of community-based services by such actions as imposing prohibited eligibility criteria, cost caps, or waiting lists or failing to provide a specific community-based service. Additionally, community-based services must be offered to individuals with such disabilities prior to institutionalization. Institutionalized individuals must be notified regularly of community-based alternatives.

The bill requires the Department of Justice and the Department of Health and Human Services (HHS) to issue regulations requiring government entities and insurance providers to offer community-based long-term services to individuals with such disabilities who would otherwise qualify for institutional placement. Government entities must ensure sufficient availability of affordable, accessible, and integrated housing that is not a disability-specific residential setting or a setting where services are tied to tenancy.

Regulations shall also (1) require government entities and insurance providers to perform self-evaluation on current services, policies, and practices and concerning compliance with requirements of this bill; and (2) require government entities to submit a transition plan. HHS must determine annually whether each government entity is complying with the transition plan and must increase funding for those in compliance.

The bill allows civil actions by individuals subjected to, or about to be subjected to, a violation of its requirements."	Pinnacle Foods, Inc.	"We are a leading manufacturer, marketer and distributor of high-quality, branded food products in North America, with annual net sales of approximately $3.1 billion in fiscal 2017. Our brand portfolio enjoys strong household penetration in the United States (""U.S.""), where our products can be found in over 85% of U.S. households. Our products are sold through supermarkets, grocery wholesalers and distributors, mass merchandisers, super centers, convenience stores, dollar stores, natural and organic food stores, drug stores, e-commerce websites and warehouse clubs in the United States and Canada, as well as in military channels and foodservice locations. Pinnacle Foods Inc. is a holding company whose sole asset is 100% ownership of Peak Finance Holdings LLC (""PFH""). PFH is a holding company whose sole asset is 100% ownership of Pinnacle Foods Finance LLC.  The Company's business is organized into the following four reportable segments: The Frozen segment, The Grocery segment, The Boulder segment and The Specialty segment Frozen Segment  Birds Eye is the largest brand in the $3.3 billion frozen vegetables category, with a 31.9% market share. Government programs, such as the USDA's My Plate program, and nutrition and health professionals continue to identify increased vegetable consumption as a key to better health. We believe that enhancing the taste of vegetables and making them exceptionally convenient are keys to driving more vegetable consumption.  Birds Eye has taken a leadership role in increasing vegetable consumption, including encouraging children to eat more vegetables. We are supporters of the USDA's My Plate program and have engaged in breakthrough marketing efforts with major multi-media family entertainment partners to encourage children to eat more vegetables. We also compete in the frozen complete bagged meals category with our Birds Eye Voila!  frozen bagged meals provide consumers with a high quality complete meal, including protein, starch, and vegetables, that can be prepared in a skillet in just minutes.  Our Frozen segment also includes Hungry-Man frozen entrées, Van de Kamp's and frozen prepared seafood, Lender's frozen and refrigerated bagels and Celeste frozen pizza. Grocery Segment Included in the Grocery segment is our Duncan Hines portfolio, which includes cake mixes, ready-to-serve frostings, brownie mixes, and cookie mixes. In addition to our traditional cake mix offerings, our cake mix portfolio also includes premium offerings under the Duncan Hines Decadent and Duncan Hines Perfect Size brands.  Duncan Hines is the #2 brand with a 28.9% market share in the $1.1 billion cake/brownie mix and frostings We compete in the shelf-stable salad dressings category with our Wish-Bone and Western brands, including our Wish-Bone E.V.O.O., Wish-Bone Ristorante Italiano and Wish-Bone Avocado Oil lines. We hold the #4 position in the $2.0 billion salad dressings category, with a combined share of 11.0%, and Wish-Bone holds the #1 position in the branded Italian segment of the category. Our Grocery segment also includes Armour, Nalley and Brooks canned meat, Mrs. Butterworth's and Log Cabin table syrups, Smart Balance premium margarine/spread, Comstock and Wilderness pie and pastry fruit fillings and Open Pit barbecue sauce.  The Grocery segment also includes a diversified portfolio of shelf-stable and refrigerated products including a complete line of shelf-stable pickle products, primarily under the nationally-distributed Vlasic brand, and the regional brands under the Milwaukee's and Wiejske Wyroby brands. Our Vlasic brand, represented by its trademark Vlasic stork, has the highest consumer awareness and quality ratings in the pickle category.  Vlasic is the #1 brand in the $790 million shelf-stable pickle category and Pinnacle pickle brands collectively hold a 34.3% market share.  We offer a portfolio of gluten-free products under the "	No
8	To amend the market name of genetically altered salmon in the United States, and for other purposes.	"Genetically Engineered Salmon Labeling Act

This bill requires the market name of genetically engineered (commonly called genetically modified or GMO) salmon to include Genetically Engineered or GE in front of the existing market name.

The Department of Health and Human Services must ensure that an independent scientific organization conducts a review of the environmental assessment carried out by the Food and Drug Administration in support of a new drug related to AquAdvantage Salmon."	Tempur Sealy International, Inc.	We develop, manufacture and market bedding products, which we sell globally. Our brand portfolio includes many highly recognized brands in the industry, including TEMPUR®, Tempur-Pedic®, Sealy® featuring Posturepedic® Technology, and Stearns & Foster®. Our comprehensive suite of bedding products offers a variety of products to consumers across a broad range of channels.  We operate in two segments: North America and International. Our North America segment consists of Tempur and Sealy manufacturing and distribution subsidiaries, joint ventures and licensees located in the U.S. and Canada. Our International segment consists of Tempur and Sealy manufacturing and distribution subsidiaries, joint ventures and licensees located in Europe, Asia-Pacific and Latin America. In the first quarter of 2017, we updated our primary selling channels to Wholesale and Direct. Wholesale includes all third party retailers, including third party distribution, hospitality and healthcare. Direct includes company-owned stores, e-commerce, and call centers. Retail included furniture and bedding retailers, department stores, specialty retailers and warehouse clubs. Other included direct-to-consumer, third party distributors, hospitality and healthcare customers.  Our goal is to improve the sleep of more people, every night, all around the world. Our Products and Brands We have a comprehensive offering of products that appeal to a broad range of consumers, some of which are covered by one or more patents and/or patent applications. In order to achieve our goal to improve the sleep of more people, every night, all around the world, one of our strategic initiatives is to leverage and strengthen our comprehensive portfolio of iconic brands and products. Our brand portfolio includes many highly recognized brands, including TEMPUR®, Tempur-Pedic®, Sealy® featuring Posturepedic® Technology and Stearns & Foster®, which are described below:  ® - Founded in 1991, the Tempur brand is our specialty innovation category leader designed to provide life changing sleep for our wellness-seeking consumers. Our proprietary Tempur material precisely adapts to the shape, weight and temperature of the consumer and creates fewer pressure points, reduces motion transfer and provides personalized comfort and support.  The Stearns & Foster brand offers our consumers high quality mattresses built by certified craftsmen who have been specially trained. Founded in 1846, the brand is designed and built with precise engineering and relentless attention to detail and fuses new innovative technologies with time-honored techniques, creating supremely comfortable beds.  The Sealy brand originated in 1881 in Sealy, Texas, and for over a century has focused on offering trusted comfort, durability and excellent value while maintaining contemporary styles and great support. The Sealy Posturepedic brand, introduced in 1950, was engineered to provide all-over support and body alignment to allow full relaxation and deliver a comfortable night's sleep. In 2017, Sealy Posturepedic no longer represented its own separate brand as we united all of our Sealy products under one masterbrand, which features the Posturepedic Technology™ in the Sealy Performance The Cocoon by Sealy brand, introduced in 2016, is our offering in the below $1,000 e-commerce space, made with the high quality materials that consumers expect from Sealy, sold online at www.cocoonbysealy.com and delivered in a box directly to consumers' doorsteps.  In North America, we united all of our Sealy products under one masterbrand. Product introductions included new Sealy products in two distinct lines: Response and Conform.	No
