index	text	answer	document_name
0	If the game package only includes multiple console games: Based on the amount of downloads of the console games, the sharing percentage among all CSPs in the package shall be calculated as follows: Total income of game package * (1 - bad debt rate) * (1 - sharing percentage for fee collection channel) *50% * (number of downloads of such CSP's online game/aggregate number of downloads of all console games contained in the game package)	Yes	IDREAMSKYTECHNOLOGYLTD_07_03_2014-EX-10.39-Cooperation Agreement on Mobile Game Business.PDF
1	Company shall pay to JHU minimum annual royalties as set forth in Exhibit A.	Yes	VirtuosoSurgicalInc_20191227_1-A_EX1A-6 MAT CTRCT_11933379_EX1A-6 MAT CTRCT_License Agreement.pdf
2	Within twenty (20) days after the end of each Calendar Quarter , GSK shall pay Theravance royalty payments based on Net Sales in such Calendar Quarter during the Term as follows: On total Annual Worldwide Net Sales up to and including U.S. $3 Billion: 15 % On total Annual Worldwide Net Sales greater than U.S. $3 Billion: 5 % it being understood that Net Sales of a single agent Collaboration Product will be combined with Net Sales of a LABA/ICS Combination Product for purposes of the foregoing royalty calculation.	Yes	INNOVIVA,INC_08_07_2014-EX-10.1-COLLABORATION AGREEMENT.PDF
3	MusclePharm shall be responsible to provide for any appearances pursuant to this Agreement by Endorser appropriate certificates of insurance with coverage limits of at least Five Million Dollars (US$5,000,000) per occurrence endorsed to name the AS Parties as additional named insureds with respect to claims arising out of appearances by Endorser.	No	MusclepharmCorp_20170208_10-KA_EX-10.38_9893581_EX-10.38_Co-Branding Agreement.pdf
4	Subject to the terms and conditions set forth herein, World Book hereby grants to HSWI, a perpetual, irrevocable limited license to use, copy, store, archive, distribute, transmit, modify (subject to Section 2.1(iv)), and Display the Content, Images and Affinities in whole or	No	RemarkHoldingsInc_20081114_10-Q_EX-10.24_2895649_EX-10.24_Content License Agreement.pdf
5	For the avoidance of doubt, if following [ * ] there is a transfer of shareholding or interests in Distributor to any existing or new shareholder(s) which results in any person or persons subsequently gaining Control of Distributor, then Google may exercise its right to terminate in accordance with this clause 5.4.	No	WHITESMOKE,INC_11_08_2011-EX-10.26-PROMOTION AND DISTRIBUTION AGREEMENT.PDF
