index	text	answer	document_name
0	Party A grants all-round exclusive rights to Party B to construct, maintain and operate the Cooperation channel.	Yes	LEJUHOLDINGSLTD_03_12_2014-EX-10.34-INTERNET CHANNEL COOPERATION AGREEMENT.PDF
1	Subject to Section 2(e), the foregoing appointment is exclusive such that Ehave shall not appoint any other Person to, nor may Ehave itself, sell or resell the use of the Ehave Companion Solution within the Field of Use anywhere in the Territory.	Yes	EhaveInc_20190515_20-F_EX-4.44_11678816_EX-4.44_License Agreement_ Reseller Agreement.pdf
2	EHS and EHN shall have the exclusive rights in and to all ingredients, product specifications, goodwill, and all other intellectual property rights associated with any Product(s); provided, however, that EHS and EHN shall not have any rights in or to Dr. Murray's name or likeness except as expressly granted in writing herein or via electronic transmission by Dr. Murray.	Yes	EmeraldHealthBioceuticalsInc_20200218_1-A_EX1A-6 MAT CTRCT_11987205_EX1A-6 MAT CTRCT_Development Agreement.pdf
3	Except to Affiliates of Valeant, Valeant's rights and obligations under this Section 2.1 are non-transferable, non-assignable, and non-delegable.	No	DovaPharmaceuticalsInc_20181108_10-Q_EX-10.2_11414857_EX-10.2_Promotion Agreement.pdf
4	No Party may assign its rights or delegate its obligations under this Agreement, whether by operation of law or otherwise, without the prior written consent of the other Party, and any assignment in contravention hereof will be null and void.	No	HC2HOLDINGS,INC_05_14_2020-EX-10.1-COOPERATION AGREEMENT.PDF
5	This Supply Agreement shall be governed by, and construed and enforced in accordance with, the laws of the State of California, without regard to any conflict of laws rules to the contrary.	No	VAXCYTE,INC_05_22_2020-EX-10.19-SUPPLY AGREEMENT.PDF
