label	text
Yes	"The Recipient shall immediately return and redeliver to the other all tangible material embodying the JEA Confidential Information provided hereunder and all notes, summaries, memoranda, drawings, manuals, records, excerpts or derivative information deriving there from and all other documents or materials (""Notes"") (and all copies of any of the foregoing, including ""copies"" that have been converted to computerized media in the form of image, data or word processing files either manually or by image capture) based on or including any JEA Confidential Information, in whatever form of storage or retrieval, upon the earlier of - I. the completion or termination of the dealings between the parties contemplated hereunder; or II. the termination of this Agreement; or "
Yes	Disclosing Party may serve written request on Recipient for return or destruction of its Confidential Information at any time up to six (6) months after the termination or expiry of this Agreement and Recipient shall, within thirty (30) days of such request or termination, return to the Disclosing Party (or its designees) or certify as destroyed all Confidential Information, in whatever form, including written or electronically recorded information and all copies thereof (other than copies retained in automatic back-up and archive systems), provided however that Recipient shall be entitled to retain one copy of the Confidential Information with its legal counsel or other appropriate corporate representative to evidence the exchange of information hereunder and in connection with legal or statutory requirements.  
Yes	In the event this Agreement is terminated, and the Disclosing Party so requests, the Receiving Party shall promptly return or destroy (and certify destruction of) all Confidential Information which it received from the Disclosing Party along with all copies.  
Yes	Upon the request of VIDAR or the termination or expiration of this Confidential Agreement, Receiver shall promptly return to VIDAR all copies of the Confidential Information and obtained by Receiver. 
No	Upon termination of the Agreement, Independent Contractor shall redeliver all tangible Confidential Information furnished by the Company.  Except to the extent Independent Contractor is advised in writing by counsel that such action is prohibited by law, Independent Contractor will also destroy all written material, memoranda, notes, and other writings or recordings whatsoever prepared by it based upon, containing, or otherwise reflecting any Confidential Information.  
No	The Confidential Information is and shall be considered valuable trade secrets owned exclusively by the Disclosing Party.  The Disclosing Party retains all right, title and interest in the Confidential Information and any reasonably related information which may be subsequently developed, and the Receiving Party waives all rights to the intellectual property and copyright therein in favour of the Disclosing Party. No license is granted to the Receiving Party in relation to any intellectual property rights that attach to or may be embodied in any Confidential Information, or is implied by the conveying of such Confidential Information to the Receiving Party. 
No	7. In the event that the Receiving Party or any of its Representatives are requested pursuant to, or required by, applicable law or regulation or by legal process to disclose any Confidential Information or any other information concerning the Disclosing Party or the Evaluation, unless prohibited by law, the Receiving Party shall provide the Disclosing Party with prompt notice of such request or requirement in order to enable the Disclosing Party  
No	The Confidential Information remains at all times the property of the Discloser, and other than as provided in this agreement, no rights in respect of the Confidential Information are granted or conveyed to the Recipient. 
