text	label
HEMISPHERX will have the option at any time to buy out this Agreement.	Yes
In the event that SFJ terminates this Agreement pursuant to this Section 14.2.1 then in exchange for purchasing the Trial Data Package including the Research Results included therein as set forth in Section 11.1.1.4, PB will pay SFJ, within [***] of the date of termination, an amount equal to three hundred percent (300%) of Development Costs paid or incurred by SFJ prior to such termination.	Yes
Notwithstanding the foregoing, upon any delay by Service Recipient in its payment of any Service Fee to Service Provider, for each day of delay in such payment, Service Recipient must pay Service Provider liquidated damages at 0.5 percent (0.5%) of the Service Fee that are due and unpaid.	Yes
IF A CLAIM OR CAUSE OF ACTION IS ATTRIBUTABLE TO A PRODUCT OR ANY SERVICES PROVIDED UNDER THE SUBSCRIPTION LICENSE AGREEMENT, THE REMEDIES SET FORTH IN THE SUBSCRIPTION LICENSE AGREEMENT, TO THE EXCLUSION OF THE REMEDIES SET FORTH IN THIS AGREEMENT, SHALL CONSTITUTE THE SOLE AND EXCLUSIVE REMEDIES AVAILABLE TO A PARTY FOR SUCH CLAIM OR CAUSE OF ACTION.	No
Supplier hereby grants Bank of America a nonexclusive, worldwide, irrevocable, perpetual license to: (a) any patents related to or necessary or desirable to use the Software to the extent such patents are now held, licensed to or hereafter acquired by Supplier, for the purpose of allowing Bank of America and its Affiliates and permitted assigns to install, copy, use, execute, modify, distribute (as necessary or useful for Bank of America and its Affiliates and permitted assigns to enjoy their rights as set forth in the Agreement), make, have made, enhance, improve and alter the Software (both in Object Code and Source Code form) as necessary to conduct Bank of America business in accordance with the terms and restrictions or this Section; (b) any Copyrights now held, licensed to or hereafter acquired by Supplier in the Software for the purpose of allowing Bank of America and its Affiliates an permitted assigns to install, copy, use, execute, modify, distribute (as necessary or useful for Bank of America and its Affiliates and permitted assigns to enjoy their fights as set forth In the Agreement, produce derivative works from and<omitted>display such Software (both in Object Code and Source Code for ); any (c) other Intellectual Property Rights or Supplier in the Software as are necessary or useful for Bank of America, its Affiliates and permitted assigns to install, copy, use, execute, modify, distribute, enhance, improve and alter and copy the Software (both in Object Code and Source Code form) for the purpose of conducting Bank of America business in accordance with the terms and restrictions of this Section.	No
