text	label
CytoDyn and Vyera are sometimes referred to herein individually as a "Party" and collectively as the "Parties."	Yes
Seller and Buyer are referred to individually at times as a "Party" and collectively at times as the "Parties".	Yes
The Licensor and the Licensee are sometimes referred to herein separately as a "party" and collectively as the "parties."	Yes
Neither party will assign any of its rights or obligations under this Agreement without the prior written consent of the other party, such consent not to be unreasonably, conditioned, withheld or delayed.	No
Subject to the terms and conditions of this Agreement, Arizona hereby grants to the Company a limited, non- exclusive, royalty-free, non-sublicensable (except as set forth in Section 7.1), non-assignable (except as set forth in Section 13.2) license in, to and under the Diamond Licensed Trademarks for the Diamond Trademark License Term for use with respect to the Diamond Product throughout the world only in the form and manner set forth on Schedule 6.2.	No
