text	label
SAP Africa warrants that the entire source code for the SOFTWARE owned by or licensed by SAP AG and/or COMMERCE ONE INC.. ("Source Code"), together with related DOCUMENTATION as it is, or becomes available, shall be deposited into an escrow account by no later than 30 June 2001 which is maintained at Volksbank Wiesloch, Germany (the "Escrow Agent"), pursuant to an agreement between the Escrow Agent and SAP AG (the "Escrow Agreement").	Yes
TELKOM may, at its own cost, verify that the new version of the Source Code is deposited with the Escrow Agent.	Yes
If no new version has been deposited in any 6 month period, HealthGate will deposit a replacement copy of the then current version of the source code of the Proprietary Software under the Escrow Agreement and will notify the Publishers in writing.	Yes
EFS shall maintain at all times during the Term of this Agreement insurance as provided below and shall name Client, its parent company, subsidiaries and affiliated entities and their respective officers, directors, shareholders, agents and employees as additional insureds to the extent of indemnity provided herein under its liability policies as follows: (i) Commercial general liability insurance including premises/operations, broad form property damage, independent contractors, and contractual liability covering EFS' obligations hereunder for bodily injury and property damage, with a combined single limit of not less than $1,000,000 each occurrence and $6,000,000 umbrella coverage; (ii) Workers' compensation insurance in statutory amounts covering EFS and its employees; and (iii) Errors and omissions insurance, and employer's liability insurance in an amount not less than $1,000,000 per accident/disease.	No
For the avoidance of doubt, the Agent currently uses and/or may in the future use the Canada Marks on products in categories other than non-selective weedkillers for Lawn & Garden Use, and the license granted to Monsanto herein shall not affect or restrict the Agent's rights in such other categories.	No
