index	text	answer
7	"Social Compliance (including disclosures under the California Transparency in Supply Chains Act of 2010)

Bed Bath & Beyond Inc. is committed to sourcing quality merchandise and developing meaningful relationships with its vendors who share common principles of social responsibility. Bed Bath & Beyond Inc. aims to cooperate with its vendors and their subcontractors on a systematic, long term basis to ensure our sourced merchandise is produced under socially responsible conditions.

Bed Bath & Beyond Inc. is constantly looking for ways to improve in the area of corporate social responsibility.  In connection with this effort, we encourage our vendors to adopt a comprehensive program of responsible practices and to prepare a corporate responsibility (or “sustainability”) report if they do not already do so. 

All vendors and their factories must follow our ""Code of Conduct"", which details our policies in regard to child labor, involuntary labor, human trafficking, disciplinary practices, non-discrimination, health and safety, environmental protection, wages and benefits, working hours, employee relations, and other items.

Code of Conduct

The Bed Bath & Beyond Inc. Code of Conduct summarizes the basic requirements concerning working conditions that must be satisfied by each vendor for every location. Bed Bath & Beyond Inc. reserves the right to change and supplement the Code of Conduct at any time.

Vendors shall familiarize workers with the Code of Conduct and display it, translated in the local language, at each of their facilities in a place readily visible and accessible to workers. Vendors shall ensure that their contractors and suppliers adhere to the Code of Conduct.

Child Labor

Vendors shall not use child labor. The international standard for defining “Child Labor” is found in the International Labor Organizations’ Convention 138 on Minimum Age for Employment (1973) which provides as follows:  “The minimum age […] should not be less than the age of compulsory schooling and, in any case, shall not be less than 15 years.” If the country of production has a more restrictive definition of child labor, then Bed Bath & Beyond will not produce product made by persons in violation of that country’s laws. Vendors must verify the age of their workers and maintain copies of their workers’ proof of age.   Vendors must follow all applicable laws and regulations regarding working hours and conditions for minors. 

Involuntary Labor

Vendor shall not use involuntary labor. “Involuntary Labor” is defined as work or service which is extracted from any person under threat or penalty for its non-performance and for which the worker does not offer himself or herself voluntarily, and includes all manner of prison, bonded, indentured and forced labor.

Human Trafficking 

Vendors and all direct suppliers to such Vendors shall comply with the laws addressing human trafficking and slavery of the country or countries where the Vendors do business. For purposes of this Code of Conduct, the operative standard for defining “Human trafficking” is taken from the U.N. Convention against Transnational Organized Crime (Palermo Protocol):   “[…] the recruitment, transportation, transfer, harbouring or receipt of persons, by means of the threat or use of force or other forms of coercion, of abduction, of fraud, of deception, of the abuse of power or of a position of vulnerability or of the giving or receiving of payments or benefits to achieve the consent of a person having control over another person, for the purpose of exploitation.   Exploitation shall include, at a minimum, the exploitation of the prostitution of others or other forms of sexual exploitation, forced labor or services, slavery or practices similar to slavery, [or] servitude; […]”

Vendors shall certify that they have implemented procedures to manage all aspects of the supply chain to ensure they comply with laws on slavery and human trafficking. Workers must be allowed to maintain control over their identity documents.

Health and Safety

Vendors shall provide workers with a clean, safe, and healthy workplace in compliance with all applicable laws and regulations.

The work environment must be safe and sanitary to ensure there are no unreasonable risks to the health and safety of all workers. Factories must implement procedures and safeguards to prevent accidents and injuries to workers; procedures and safeguards include, but are not limited to, inspection of buildings, machinery, and fire extinguishers. Regular and recorded health and safety training shall be provided for all new or reassigned workers and management.

Vendors shall ensure that workers have access to clean drinking water, sanitary washing facilities, and an adequate number of toilets.

Aisles, exits, and stairwells must be kept unblocked at all times. The workplaces must provide adequate lighting and ventilation.

Vendors must maintain appropriate chemical safety ensuring proper chemical storage, eye wash stations, and Personal Protective Equipment for workers, as applicable.

Environmental Protection

Vendors should ensure that every manufacturing facility complies with environmental laws, including all laws related to waste disposal, air emissions, discharges, toxic substances, and hazardous waste disposal, as well as procedures for notifying local authorities in the event of an environmental accident resulting from the Vendor’s operations.

Factories must take steps to ensure that all input materials and components were obtained from permissible sources consistent with international treaties and local laws and regulations. Appropriate and adequate environmental training should be provided to all workers and management.

Wages and Benefits

Vendors shall provide wages and benefits that comply with all applicable laws and regulations or match the prevailing local manufacturing or industry rates, whichever is higher. Overtime pay shall be calculated at the legally required rate, regardless of whether workers are compensated hourly or by piece rate.

Factories must compensate all workers in accordance with the law and where applicable with contractual agreements. Workers must be provided with written and understandable details regarding their employment and compensation.

Working Hours

Vendors shall not require workers to work, including overtime, more than 60 hours per week or more than any maximum number of hours per week established by applicable laws and regulations, whichever is less. Vendors shall guarantee that workers receive at least one day off during each seven day period.

Employee Relations

Vendors shall respect the right of workers to take advantage of any laws relating to employee management relations.

Dormitories and Canteen

Factories that provide residential and dining facilities for their workers must provide safe, healthy, and sanitary facilities.

All areas of the dormitory facilities shall be kept secure, clean and have safety provisions (such as fire extinguishers, first aid kits, unobstructed emergency exits, emergency lighting, etc.). Emergency evacuation drills shall be conducted at least once a year. Additionally, Factories shall provide appropriate washroom facilities, including adequate toilets and showers segregated by gender. The facility should also have security measures to protect employees and their property.  Dormitories must be in compliance with all housing laws and regulations, occupancy requirements, and health and safety laws. 

Legal Requirements

Vendors shall comply with all legal requirements applicable to the conduct of their businesses, including those set out above.

Management at the Company has also participated in webinars and attended presentations organized by reputable third party industry groups with respect to the requirements of the California Transparency in Supply Chains Act of 2010. Internal team members with direct responsibility for supply chain have also participated in training on slavery and human trafficking.

Social Compliance Audits

Though the amount of product sold in our stores that is imported directly by us is a very small portion of our business, Bed Bath & Beyond, buybuy BABY, and Harmon, Harmon Face Values have developed a Social Compliance Audit Program for all vendors of direct import merchandise.  In addition, Bed Bath & Beyond and buybuy BABY have instituted the same requirements for vendors of private label products whether imported or domestically sourced.  The requirements of the Social Compliance Audit Program are communicated to vendors through our Quality Assurance Manual.

All vendors or Buying/Selling Agents are required to be fully knowledgeable of all factories and labor arrangements used in the production of goods. 

The Company has partnered with an ISO accredited, worldwide, independent laboratory to implement the Social Compliance Audit Program.  Audits initiated by the Company are conducted on a semi-unannounced basis. All vendors or their agents must allow the Company’s partner to conduct both scheduled and unscheduled inspections of their facilities for the purpose of ensuring compliance with the Code of Conduct and employee health and safety standards. During audits, the Company maintains the right to, among other things, review all employee related books and records maintained by the vendor and to interview workers outside the presence of factory management.  The audit also includes protocols to assess risks of human trafficking and slavery.  Any deficiencies identified in a Social Compliance Audit must be remedied within a reasonable timeframe.  

All vendors are required to sign our Import Vendor Compliance Guide Acknowledgment Form, which confirms their acceptance and certifies their compliance with all of the above policies."	No
