index	text	answer	document_name
0	Subject to Clauses 9.1 and 9.2, neither party shall be liable under this Agreement (whether in contract, tort or otherwise) for any: (a) loss of anticipated savings; (b) loss of business opportunity (which for the avoidance of doubt shall not include loss of advertising revenue); (c) loss of or corruption of data; (d) loss or damage resulting from third party claims; or (e) indirect or consequential losses; suffered or incurred by the other party (whether or not such losses were within the contemplation of the parties at the date of this Agreement).	Yes	WHITESMOKE,INC_11_08_2011-EX-10.26-PROMOTION AND DISTRIBUTION AGREEMENT.PDF
1	Accordingly, LBIO shall have available, in addition to any other right or remedy available to it, the right to seek an injunction from a court of competent jurisdiction restraining such a breach (or threatened breach) and to specific performance of any such Section.	Yes	IOVANCEBIOTHERAPEUTICS,INC_08_03_2017-EX-10.1-STRATEGIC ALLIANCE AGREEMENT.PDF
2	EXCEPT WITH RESPECT TO THE INDEMNIFICATION OBLIGATIONS SET FORTH IN SECTION 9 WITH REGARD TO CLAIMS BY THIRD PARTIES, IN NO EVENT SHALL EITHER PARTY BE LIABLE FOR CONSEQUENTIAL, INDIRECT, INCIDENTAL, SPECIAL, EXEMPLARY, PUNITIVE OR ENHANCED DAMAGES, LOST PROFITS OR REVENUES OR DIMINUTION IN VALUE ARISING OUT OF, RELATING TO, OR IN CONNECTION WITH ANY BREACH OF THIS AGREEMENT OR CLAIM HEREUNDER, REGARDLESS OF (A) WHETHER SUCH DAMAGES WERE FORESEEABLE, (B) WHETHER OR NOT IT WAS ADVISED OF THE POSSIBLITY OF SUCH DAMAGES, AND (C) THE LEGAL OR EQUITABLE THEORY (CONTRACT, TORT OR OTHERWISE) UPON WHICH THE CLAIM IS BASED.	Yes	ReedsInc_20191113_10-Q_EX-10.4_11888303_EX-10.4_Development Agreement.pdf
3	CytoDyn shall have the right to terminate this Agreement in its entirety upon written notice to Vyera on the occurrence of any of the following:<omitted>(c) Vyera breaches its obligations or covenants under Section 2.6 (Competitive Products);	No	CytodynInc_20200109_10-Q_EX-10.5_11941634_EX-10.5_License Agreement.pdf
4	Each party agrees that the sole and exclusive remedy for a breach of the warranties set forth in this Section 12 shall be the indemnification set forth in Section 13 below.	No	EdietsComInc_20001030_10QSB_EX-10.4_2606646_EX-10.4_Co-Branding Agreement.pdf
5	VerticalNet hereby grants to LeadersOnline a non- exclusive, non-transferable, royalty-free right and license to link to the VerticalNet Site.	No	LeadersonlineInc_20000427_S-1A_EX-10.8_4991089_EX-10.8_Co-Branding Agreement.pdf
