label	text
Yes	No other right or license, whether expressed or implied, in the Confidential Information is granted to the Parties hereunder.  
Yes	Neither the execution of this Agreement nor the disclosure of any Confidential Information is construed as granting either expressly or by implication, estoppel or otherwise, any license or right to the Confidential Information or any intellectual property rights embodied therein. 
Yes	7. Neither this Agreement nor the supply of any information grants the Recipient any licence, interest or right in respect of any intellectual property rights of the Discloser except the right to copy the Confidential Information solely for the Purpose. 
Yes	8. Title to, interest in, and all other rights of ownership to Confidential Information shall remain with the Disclosing Party.  
No	c. The obligations specified in this Article shall not apply to Information for which the receiving Party can reasonably demonstrate that such Information: iv. was independently developed by the receiving Party without access to the disclosing Party’s Information. 
No	The term “Representative” means, as to any person, such person’s affiliates, officers, directors, general partners, members, employees, consultants, investment bankers, financial advisors, accountants, legal counsel, consultants and potential lenders.  (b) Except as otherwise permitted under this Agreement or as required by applicable law, regulation, stock exchange rule or by legal, judicial, regulatory or administrative process (by oral questions, interrogatories, requests for information or documents in legal proceedings, subpoena, civil investigative demand or other similar process) (“Legally Required”),  (a) the Receiving Party shall, and shall cause its Representatives to, keep all Proprietary Information confidential and not disclose or reveal any Proprietary Information to any person other than its Representatives who are participating in evaluating, negotiating, advising or financing with respect to the Possible Transaction or who otherwise need to know the Proprietary Information for the purpose of evaluating, negotiating, advising or financing with respect to the Possible Transaction (all of whom shall be informed of the confidential nature of such Proprietary Information) and shall cause its Representatives to treat such Proprietary Information in a confidential manner and in accordance with the terms hereof, provided that each party shall be responsible for any breach of this Agreement by any of its respective Representatives,  
No	Without limiting the aforesaid, the existence of discussions between the Parties regarding the Proposed Transaction shall constitute Confidential Information hereunder. a. The Receiving Party shall hold confidential and not disclose to any Person, without the prior written consent of the Disclosing Party, all Confidential Information and any information about the Proposed Transaction, or the terms or conditions or any other facts relating thereto, including, without limitation, the fact that discussions are taking place with respect thereto or the status thereof, or the fact that Confidential Information has been made available to the Receiving Party or its Representatives; provided, however, that the Receiving Party may disclose such Confidential Information to its Representatives who are actively and directly participating in its evaluation of the Proposed Transaction or who otherwise need to know the Confidential Information for the purpose of evaluating the Proposed Transaction; All media releases, public announcements and other disclosures by either Party relating to this Agreement or the subject matter hereof, including promotional or marketing material, but excluding announcements intended solely for internal distribution or to meet legal or regulatory requirements, shall be coordinated with and approved by the other Party prior to release.  
No	(b) Nothing in this Agreement will prohibit Receiving Party from disclosing Confidential Information of Disclosing Party if legally required to do so by judicial or governmental order or in a judicial or governmental proceeding (“Required Disclosure”); provided that Receiving Party shall:  (i) give Disclosing Party reasonable notice of such Required Disclosure prior to disclosure;  
