text	label
by creating a tinder account or by using the tinder imessage app ( `` tinder stacks '' ) , whether through a mobile device , mobile application or computer ( collectively , the `` service '' ) you agree to be bound by ( i ) these terms of use , ( ii ) our privacy policy and safety tips , each of which is incorporated by reference into this agreement , and ( iii ) any terms disclosed and agreed to by you if you purchase additional features , products or services we offer on the service ( collectively , this `` agreement '' ) .	Contract by using
we may make changes to this agreement and to the services from time to time .	Unilateral change
tinder may terminate your account at any time without notice if it believes that you have violated this agreement .	Unilateral termination
though tinder strives to encourage a respectful user experience through features like the double opt-in that only allows users to communicate if they have both indicated interest in one another , it is not responsible for the conduct of any user on or off of the services .	Limitation of liability
we may delete any content , in whole or in part , that in our sole judgment violates this agreement or may harm the reputation of the service .	Content removal
the exclusive means of resolving any dispute or claim arising out of or relating to this agreement ( including any alleged breach thereof ) or the service shall be binding arbitration administered by the american arbitration association under the consumer arbitration rules .	Arbitration
in the event that this arbitration agreement is for any reason held to be unenforceable , any litigation against the company ( except for small-claims court actions ) may be commenced only in the federal or state courts located in dallas county , texas .	Jurisdiction
this agreement , and any dispute between you and the company , shall be governed by the laws of the state of texas without regard to principles of conflicts of law , provided that this arbitration agreement shall be governed by the federal arbitration act .	Choice of law
