label	text
Yes	The obligations and restrictions imposed by this Agreement will not apply to any information that: c. was received by the Recipient without breach of this Agreement from a third party without restriction as to the use and disclosure of the Discloser's Confidential Information; or, 
Yes	Recipient shall have no obligation of confidentiality with respect to any information which: 5.3. is rightfully acquired from others who did not obtain it under obligation of confidentiality; or Disclosing Party understands that Recipient may develop or have developed information internally, or receive or have received information from other parties that is similar to the Confidential Information.  
Yes	2. The term Confidential Information shall not include information, which is: (b) rightfully received from a third party with no duty of confidentiality; or 
Yes	Receiver may disclose Confidential Information if the same: (d) becomes known to Receiver on a non-confidential basis from a source other than VIDAR without breach of this Agreement by Receiver; 
No	6.2. Except as provided herein, no right or license whatsoever, either expressed or implied, is granted to either party pursuant to this Agreement under any patent, patent application, trademark, copyright or other proprietary right now or hereafter owned or controlled by the other party. 
No	The term “Representative” means, as to any person, such person’s affiliates, officers, directors, general partners, members, employees, consultants, investment bankers, financial advisors, accountants, legal counsel, consultants and potential lenders.  (b) Except as otherwise permitted under this Agreement or as required by applicable law, regulation, stock exchange rule or by legal, judicial, regulatory or administrative process (by oral questions, interrogatories, requests for information or documents in legal proceedings, subpoena, civil investigative demand or other similar process) (“Legally Required”),  (a) the Receiving Party shall, and shall cause its Representatives to, keep all Proprietary Information confidential and not disclose or reveal any Proprietary Information to any person other than its Representatives who are participating in evaluating, negotiating, advising or financing with respect to the Possible Transaction or who otherwise need to know the Proprietary Information for the purpose of evaluating, negotiating, advising or financing with respect to the Possible Transaction (all of whom shall be informed of the confidential nature of such Proprietary Information) and shall cause its Representatives to treat such Proprietary Information in a confidential manner and in accordance with the terms hereof, provided that each party shall be responsible for any breach of this Agreement by any of its respective Representatives,  
No	This agreement does not grant any implied intellectual property licenses to confidential information, except as stated above.  
No	The obligation of confidentiality and restriction on use in Section 2 hereof shall not apply to any Confidential Information that the Receiving Party proves: (e) is subsequently and independently developed by employees, consultants or agents of the Receiving Party without reference to the Confidential Information of the Disclosing Party disclosed under this Agreement. 
