text	label
An Event of Default shall mean any of the following occurrences:<omitted>the occurrence of a Change of Control of an SMG Target without the prior written consent of Monsanto, unless the Agent has determined in its reasonable commercial opinion that such acquiror can and will fully perform the duties and obligations of the Agent under this Agreement;	Yes
The parties acknowledge and agree that a "Release Condition" for purposes of the Escrow Agreement shall be deemed to mean any one or more of the following listed events (in addition to any other event specified as a release condition under the Escrow Agreement):<omitted>(vi) Ehave undergoes a change of control or is a party to a merger or amalgamation;	Yes
To exercise its right to make the Change of Control Buy-Out Payment, PB or its successor shall provide written notice to SFJ (the "Change of Control Buy-Out Notice") no later than [***] after the date of closing of such Change of Control, which written notice shall set forth the amount of the applicable Change of<omitted>Control Buy-Out Payment, the proposed date of closing of the buy-out (which shall occur within [***] after the date of closing of such Change of Control), and the calculation of the Change of Control Buy-Out Payment in reasonable detail based upon the proposed closing date of the buy-out.	Yes
mPhase shall have the right to annually renew this agreement for a period of one year upon each annual expiration with the written consent of Lucent, which written consent shall not be unreasonably withheld.	No
EXCEPT IN CONNECTION WITH A BREACH BY EITHER PARTY OF ARTICLE 9 OR SECTION 10.1.4 [Representations and Warranties] (v) AND THE INDEMNIFICATION OBLIGATIONS OF LEADERSONLINE UNDER SECTION 11.4(i)(c) [Indemnification by LeadersOnline] AND THE INDEMNIFICATION OBLIGATIONS OF VERTICALNET UNDER SECTION 11.5(i)(c) [Indemnification by VerticalNet], NEITHER PARTY WILL BE LIABLE FOR ANY SPECIAL, INDIRECT, CONSEQUENTIAL, EXEMPLARY OR INCIDENTAL DAMAGES ARISING OUT OF OR RELATED TO THIS AGREEMENT, HOWEVER CAUSED AND UNDER ANY THEORY<omitted>OF LIABILITY (INCLUDING NEGLIGENCE), EVEN IF SUCH PARTY HAS BEEN ADVISED OF THE POSSIBILITY OF SUCH DAMAGES.	No
