index	answer	text	document_name
0	Yes	The term “Confidential Information” as used herein means all nonpublic information relating to the Subject Matter that is disclosed by either party, its Affiliates (as defined below), or their agents (where applicable, collectively referred to as the “Disclosing Party”), directly or indirectly, in writing, orally or by inspection of premises or tangible objects to the other party (the “Recipient”) that is:  	01_Bosch-Automotive-Service-Solutions-Mutual-Non-Disclosure-Agreement-7-12-17.pdf
1	Yes	4. The undertakings in clauses 2 and 3 above apply to all of the information disclosed by the Discloser to the Recipient, regardless of the way or form in which it is disclosed or recorded but they do not apply to: 	118.3-Non-disclosure-agreement.pdf
2	Yes	"1. The confidential, proprietary and trade secret information of the Disclosing Party (hereinafter ""Confidential Information"") provided hereunder is any and all information, in whatever form (including electronic data) that will be disclosed to facilitate the potential transaction of business (related to the provision of SAP Services to HRM) between the Parties, including, but not limited to, portions or parts of the November 1, 2012 Agreement (including any schedules or appendices) between the Province of Nova Scotia and IBM, each Party's disclosure of intellectual property, techniques, sketches, drawings, models, inventions, know-how, processes, apparatus, equipment, algorithms, software programs, software source documents, and formulae related to the current, future and proposed products, documents and services, research, experimental work, development, design details and specifications, engineering, financial information, procurement requirements, purchasing, manufacturing, licensing, sales or service customer lists, business forecasts, sales and merchandizing, and marketing plans and information.  "	130806ca141.pdf
3	Yes	1. Disclosure: Recipient agrees not to disclose and the Discloser agrees to let the Recipient have the access to the Confidential Information as identified and reduced in writing or provided verbally or in any other way not reduced in writing at the time of such disclosure of the information. 	1588052992CCTV%20Non%20Disclosure%20Agreement.pdf
4	No	Confidential Information shall mean the following: a) all such information, of any kind whatsoever (whether in oral, written or electronic form, and including, but not limited to, technical, commercial, financial, accounting, legal and administrative information) pertaining to the Sale of the Munt and the Sellers as may be provided to the Disclosee and their responsible managers, officers, employees, shareholders, members of the Board of Directors and advisors (including financial, legal and tax advisors and auditors) (“Representatives”), by the Sellers, their advisors or their representatives; 	12032018_NDA_The%20Munt_EN.pdf
5	No	(a) “Confidential Information” means any proprietary information that is disclosed in writing by Disclosing Party (defined herein) to Receiving Party (defined herein) and is duly and recognizably marked “Confidential” on each document / sheet.  	amc-general-mutual-non-disclosure-agreement-en-gb.pdf
6	No	All Confidential Information received from the disclosing party shall be in tangible form.  	883905_0001095811-01-000469_f68556ex99-d12.txt
7	No	11. Nothing contained in the Agreement shall be construed as granting any rights under any patent, trademark or copyright, by license or otherwise, protecting any Information subject to this Agreement, and that this Agreement does not create a partnership, joint venture or other legal relationship between the Parties.  	confidentiality-agreement.pdf
