text	label
For those countries where a specific license is required for a joint owner of a Joint Invention or Joint Improvement to practice such Joint Invention or Joint Improvement, in such country, each Party hereby grants to the other Party a perpetual, irrevocable, non-exclusive, worldwide, royalty-free, fully paid-up license, transferable and sublicensable, under such Party's right, title and interest in and to such Joint Invention or Joint Improvement to freely exploit such Joint Invention or Joint Improvement in such country, subject to the terms and conditions of this Agreement and the licenses granted hereunder.	Yes
Except to the extent any jointly-owned inventions or intellectual property are included in subject matter licensed by one Party to the other Party under this Agreement, each Party may only practice any such jointly-owned inventions or intellectual property for its own internal purposes, and neither Party shall have the right to enforce, license, or assign such jointly- owned inventions or intellectual property, without the prior written consent of the other Party.	Yes
if such rights comprise (i) analysis prepared for or on behalf of the Parties as participants in the Company-Skype Branded Application, or (ii) any intellectual property right co-developed by the Parties, or (iii) of any Support Information, or (iv) any data as specifically provided to Skype or the Online Group by Company-Skype Branded Customers ("Joint Data"), other than that set forth in Sections 4.2.3.2.1 and 4.2.3.2.2 above and other than any Group Rights or Skype Rights, then such rights shall be jointly owned by the Parties, and may be exploited by any Party in accordance with this Agreement, and outside of this Agreement to the extent such exploitation would not, (x) in the case of Online BVI, violate or infringe upon the Skype Rights, (y) in the case of Skype, violate or infringe upon the Group Rights, or (z) in the case of the Company, violate or infringe upon the Group Rights or the Skype Rights.	Yes
This Agreement shall terminate and, subject to the provisions set forth below, be of no further force or effect on the exercise by the Sponsor of its right to terminate this Agreement as provided in subsection 6.2, provided that, in any event, sections 3, 7 and 8 and, in the event that such termination occurs by virtue of paragraph 6.2(b), subsection 2.5 shall not terminate (except as set forth therein) and shall continue in full force and effect for the benefit of the Sponsor or the other parties to this Agreement, as the case may be.	No
Arizona agrees to assign and hereby assigns its entire right, title and interest in and to the Arizona Assigned IP to the Company.	No
