text	label
Each insurance policy must name us (and, if we so request, our members, directors, employees, agents, and affiliates) as additional insureds, and must provide us with thirty (30) days' advance written notice of any material modification, cancellation, or expiration of the policy. Deductibles must be in reasonable amounts, and are subject to review and written approval by us.	Yes
A copy of such insurance policy shall be provided to North within thirty (30) days after execution of this Agreement.	Yes
Where possible, MSL will be jointly insured with respect to the IBM owned tooling for its interest.	Yes
Talent represents and warrants that he has not granted nor will he grant to any other party any right, permission, or license to use the Property in connection with the advertisement, sale, or promotion of the Product or in connection with products that are identical or substantially similar to the Product.	No
The Professional hereby grants to the Company the exclusive and worldwide right to use her name, likeness, image and personal identification, singly or in any combination, during the Term and for a period of six (6) months after the Term as provided in Section 2.8, in the creation of two (2) print advertisements per year and one (1) television advertisement per year (together, the "Advertisements") for any golf equipment, along with all rights in any images, videos, advertisement copy or other materials created by the Professional or others.	No
